nombre,usuario,fecha,texto,emoticon,cantidad_comentarios,cantidad_likes,cantidad_retweets,link
Ing Rodolfo Hernandez !,Ing Rodolfo Hernandez !,,,,,,,
MARTHA LUCIA FERNAND,MARTHA LUCIA FERNAND,2021-08-17T14:37:42.000Z,Senilidad...,,,,,https://twitter.com/PACALUCIAALONSO/status/1427640785760047110
SOSColombia con el 2022,SOSColombia con el 2022,2021-08-17T14:38:15.000Z,Jajajaja de Hitler a EInsten está bien lejos,,2,3,59,https://twitter.com/walhcar/status/1427640925585543171
Julián,Julián,2021-08-17T14:39:19.000Z,"En el vídeo el dice el pensador alemán que dijo ""Si buscas resultados distintos, no hagas siempre lo mismo"".
Hitler ni era pensador, ni dijo esa frase ni era alemán.
Einstein si dijo esa frase, si era pensador y si era alemán.
Aún está bien lejos?",,4,6,54,https://twitter.com/Juliandux/status/1427641193589088262
Ramiro Parra,Ramiro Parra,2021-08-17T14:41:16.000Z, La vejez que le deja escapar marranadas,,,,3,https://twitter.com/RamiroP19149878/status/1427641684628807691
Wilmer Javier Gomez Martinez,Wilmer Javier Gomez Martinez,2021-08-17T14:43:52.000Z,"Jajajajja nada más me lo imagino como presidente, espero mejor cometa las cagadas sin serlo que cuando lo sea (si llegase a serlo ) , por qué de cagadas ya estamos aburrido con ivancito 
@IvanDuque
 que cada día se parece más a su homólogo de venezuela.",,2,1,15,https://twitter.com/wilmergomez13/status/1427642337027665923
Sebastian S.,Sebastian S.,2021-08-17T15:18:39.000Z,"Pues hay que ver quién las reconoce y se disculpa, creo que nunca he visto a Ivan duque ni aceptándola y mucho menos disculpándose",,,,15,https://twitter.com/SerraSeb/status/1427651091290890244
Antonio Fajardo S.,Antonio Fajardo S.,2021-08-17T14:44:43.000Z,Una equibocacion que no vale un peso.... se debe hacer escandalo por otras cosas mas importantes,,7,1,5,https://twitter.com/AntonioFajardoS/status/1427642551406931981
Jimmy Sanchez,Jimmy Sanchez,2021-08-17T14:45:16.000Z,Jajajajaja  energúmeno,,,,1,https://twitter.com/JimmyASanchick/status/1427642689676251149
Carlos Ivan Miranda,Carlos Ivan Miranda,2021-08-17T14:46:52.000Z,PLOP!!!,,,,1,https://twitter.com/carlosivanlegal/status/1427643095164796930
Cristian,Cristian,2021-08-17T14:47:19.000Z,"Jajajajajajjajajajaja ya la cago, lo dijo con mucha seguridad",,1,,4,https://twitter.com/Crgomez1411/status/1427643207085592580
Antiuribista,Antiuribista,2021-08-17T14:47:49.000Z,"jajaja , pero quien carajo confunde a Einstein con Hitler???, osea pffff",,9,6,149,https://twitter.com/miguel_monsal/status/1427643333267140618
David Lopez,David Lopez,2021-08-17T14:49:35.000Z,"A cualquiera le pasa, pero no a el futuro presidente",,3,,1,https://twitter.com/Entropia321/status/1427643776470818821
Felipe Abondano,Felipe Abondano,2021-08-17T14:51:06.000Z,Siga así.,,,,,https://twitter.com/AbondanoFelipe/status/1427644159196868609
Julio Vargas,Julio Vargas,2021-08-17T14:53:57.000Z,"Lo admira tanto que cree que todas las frases célebres son de él.

#Populismo.
#Matarife",,1,,6,https://twitter.com/jvargasvil/status/1427644877525983237
Leandro82,Leandro82,2021-08-17T14:55:11.000Z,Señor ex alcalde.. que paso con lo de Vitalogic... ? ya lo absolvieron?.. o sigue en proceso,,,,1,https://twitter.com/Leandro8213/status/1427645184557428755
Sherlock Jorges,Sherlock Jorges,2021-08-17T14:57:16.000Z,Es que ser presidente a los 77 años va a ser complicado si la cabeza ya no le da. Pero felicitaciones por el tercer puesto en las encuestas.,,3,,5,https://twitter.com/SherlockJorges/status/1427645712037203971
Ricardo Montañez Castro,Ricardo Montañez Castro,2021-08-17T15:01:54.000Z,"Desde que dijo que estaba en deuda con 
@AlvaroUribeVel
 sabíamos que usted no representaba una alternativa viable para el país ",,2,1,20,https://twitter.com/richard13mc/status/1427646877034504208
Álvaro Benedetti - Desarrollo,Álvaro Benedetti - Desarrollo,2021-08-17T15:03:07.000Z,"Pilas con las metidas de pata, cuestan demasiado al final. Nuestro concurso en el direccionamiento estratégico de la campaña 
@AriLandsmart
 @estrategios",,2,,1,https://twitter.com/dialbenedetti/status/1427647185148055563
Un Man X,Un Man X,2021-08-17T15:07:48.000Z,Chupelo payaso,,,,1,https://twitter.com/UnMan_X/status/1427648363030274055
RodriguezDavid,RodriguezDavid,2021-08-17T15:08:00.000Z,"Todos tenemos derecho al beneficio de la duda, pero ese lapsus no es muy creíble ingeniero.",,1,,3,https://twitter.com/AmbientalDavidR/status/1427648412112015366
Alejo Merchan,Alejo Merchan,2021-08-17T15:10:57.000Z,Ingeniero usted me hace reír cada de habla de esos politiqueros jajajaja me esta convenciendo para votar por usted,,,,,https://twitter.com/alejomerchan11/status/1427649152641556480
ka.trina,ka.trina,2021-08-17T15:12:45.000Z,"Ingenieto, recuerde q la centro derecha es el camino. NO LO PIERDA",,,,1,https://twitter.com/Esingenieria/status/1427649608142917641
avca,avca,2021-08-17T15:17:16.000Z,Oops!!,,,,1,https://twitter.com/AVCAAAA/status/1427650742228328463
ricardo toloza rueda,ricardo toloza rueda,2021-08-17T15:17:29.000Z,"Bueno aceptadas las disculpas, ahora por favor ayude a aportar soluciones para el problemón de las basuras. Pero otra que no sea VITALOGIC.",,,,6,https://twitter.com/ricardotoloza60/status/1427650799216340992
Epa Colombia,Epa Colombia,2021-08-17T15:20:49.000Z,Convencido!!!,,,,1,https://twitter.com/Epa__Colombia/status/1427651639377334282
David Porras,David Porras,2021-08-17T15:21:50.000Z,"El 
@ingrodolfohdez
 va a ser el próximo presidente de COLOMBIA ",,,,3,https://twitter.com/PORRASOPINION/status/1427651891283046401
Analista,Analista,2021-08-17T15:23:36.000Z,Así de SIMPLE:,,1,9,58,https://twitter.com/Analist56181232/status/1427652337384968192
daneluc,daneluc,2021-08-17T21:45:29.000Z,Jajajaa....,,,,,https://twitter.com/daneluc/status/1427748439866105860
Joel J Ruiz,Joel J Ruiz,2021-08-17T15:24:59.000Z,Que hombre ,,1,,,https://twitter.com/jjruiz_8709/status/1427652686405636102
FuManChu,FuManChu,2021-08-17T15:25:18.000Z,Ojalá por la mañana no confunda la mierda con su desodorante…,,,,1,https://twitter.com/sardianra/status/1427652765816328201
Cristian,Cristian,2021-08-17T15:34:29.000Z,Hola don adolfo,,,,1,https://twitter.com/Crgomez1411/status/1427655077553229825
Goret,Goret,2021-08-17T15:35:11.000Z,Relax amigo que usted nos va a sacar del mierdero en el que nos tiene Duque.,,1,,1,https://twitter.com/DebnamCYP/status/1427655254959591441
Santiago Castellanos,Santiago Castellanos,2021-08-17T15:36:17.000Z,Con el mayor respeto por los payasos....pensar que un personaje de estos nos gobierne es salir de GuateMALA a GuatePEOR....UNA PAYASADA CONSTANTE.,,2,1,5,https://twitter.com/santiagocm70/status/1427655528252116993
malu ang,malu ang,2021-08-17T15:37:06.000Z,"Perdonado., Ing.  Igual hay que exterminar la corrupción que nos está matando. Cuenta con el voto de toda mi familia ",,1,,1,https://twitter.com/malugonzalez5/status/1427655733718487040
Juan Bravo,Juan Bravo,2021-08-17T15:41:00.000Z,Dándoselas de estudioso.,,,,1,https://twitter.com/JuanBravoR96/status/1427656716179714051
Mauricio Quintana Barreneche,Mauricio Quintana Barreneche,2021-08-17T15:41:36.000Z,"Excelente haber corregido el error rápidamente. Equivocarse es normal, lo que no es normal es escuchar políticos pidiendo disculpas y reconociendo errores. Eso es lo q necesita el país.",,8,1,16,https://twitter.com/quintash2000/status/1427656868428754950
La Resistencia,La Resistencia,2021-08-17T16:26:32.000Z,Y decir que le debe mucho a Uribe es normal?,,2,,4,https://twitter.com/Resistencia_48/status/1427668175127187459
EL GUARAPERO,EL GUARAPERO,2021-08-17T15:41:54.000Z,Mucha gueva,,,,1,https://twitter.com/viticor_ch/status/1427656941476712452
EL GUARAPERO,EL GUARAPERO,2021-08-17T15:42:21.000Z,"@MariaFdaCabal
 2.0",,,,1,https://twitter.com/viticor_ch/status/1427657054395719683
Jorge.Gomez26,Jorge.Gomez26,2021-08-17T15:48:55.000Z,"Ni 
@NicolasMaduro
 comete esos desatinos, maestro. ",,,,1,https://twitter.com/Gomez26Jorge/status/1427658707752693764
Victor Pardo,Victor Pardo,2021-08-17T16:07:38.000Z,Uff y yo esperando los campos de concentración para ladrones y ampones.,,1,1,3,https://twitter.com/vmpardo/status/1427663419713507332
Jasevillano,Jasevillano,2021-08-17T16:08:32.000Z,"Grandeza, lo felicito son pocos los q reconocen su errores y adicional ofrecen disculpa al agraviado.",,3,,1,https://twitter.com/jasevillano10/status/1427663643932516353
walter gamboa,walter gamboa,2021-08-17T16:16:51.000Z,"Lo traicionó el subconciente, impulso reprimido, de tener la inteligencia de Einstein, pero la maldad y autoritarismo de Hitler, total entre Rodolfo y Adolfo no hay mayor diferencia... Que escondes Dolfo?",,1,1,18,https://twitter.com/gamboa_walter/status/1427665739176161284
David Rozo,David Rozo,2021-08-17T16:19:54.000Z,"Confundir Albert con Adolf, es como confundir Rodolfo con Adolfo. Jajajaja",,17,37,417,https://twitter.com/DonIzquierdo_/status/1427666505475497990
Antares,Antares,2021-08-17T16:27:10.000Z,"Soy Petrista, pero no significa que Rodolfo no pueda equivocarse. 

Al menos se demoró mucho menos que Petro en rectificar lo de las vacunas. Que defendía y defendía y defendía y solo la cagaba más y más. También hay cosas que aceptar.",,13,1,70,https://twitter.com/Antares019/status/1427668335144194051
Juan Sebastián Elcano,Juan Sebastián Elcano,2021-08-17T16:20:40.000Z,"Errar es de humanos, ánimo Ingeniero, para adelante contra todos los corruptos!",,5,1,9,https://twitter.com/muy_espirituoso/status/1427666699654946817
Dittoly.,Dittoly.,2021-08-17T16:21:11.000Z,"Jajaja, como que ya no le estoy creyendo de a mucho, primero que le debe favores a Uribe y que lo admira, le pega a un concejal porque le dice que el hijo está inmiscuido en corrupción y ahora que idolatra a Hitler, se imagina en el poder un facho de closet será?.",,3,2,30,https://twitter.com/alexdictto/status/1427666830513086468
Fernando,Fernando,2021-08-17T16:32:13.000Z,"Ánimo Ingeniero errar es de humanos, un lapsus le pasa,a cualquiera. Y está bien corregir y disculparse. Tenemos un Titere que a diario la CAGA y nunca reconoce y mucho menos se disculpa. Todo porque ASÍ LO QUERÍ. o lo ""QUERIERON"" los que votaron por él.",,1,1,6,https://twitter.com/Fernand84141800/status/1427669607700172810
Cami,Cami,2021-08-17T16:34:49.000Z,"@SoyJorgeNoJuan
 Jajajajajajaa que lapsus tan gono",,2,,4,https://twitter.com/Mary_Janec/status/1427670260778479622
Jdavid,Jdavid,2021-08-17T16:37:00.000Z,Jajajaja Einstein Adolfo!! Jajaja,,,,1,https://twitter.com/SoyJorgeNoJuan/status/1427670810244812810
Manuel Vásquez R.,Manuel Vásquez R.,2021-08-17T16:35:24.000Z,Se le aceptan las disculpas pero lo hecho está hecho ... Su campaña presidencial se fue al caño.,,1,,1,https://twitter.com/ManuelVasquez_1/status/1427670406111141894
Daniel Alvarado,Daniel Alvarado,2021-08-17T16:36:53.000Z,"@DCoronell
 sacó ese audio de 11 segundos de hace 5 años para atacar a Rodolfo Hernández. Parecido a la jugadita del 2018 con la foto viejísima de Petro cuando ers guerrillero. Le abono mucho mucho a Coronell pero esa faceta sí es lamentable.",,,,1,https://twitter.com/daniloquio/status/1427670781274775555
Hugo Mercado,Hugo Mercado,2021-08-17T16:40:20.000Z,"Creo 
@ingrodolfohdez
 que sí está en deuda con Uribe, UD. No es una opción.",,,,1,https://twitter.com/hmercador/status/1427671649739018241
Pedrucho,Pedrucho,2021-08-17T16:52:03.000Z,"Da risa ver como le buscan caídas pendejas al ingeniero por lo que dice, si fuera perfecto seria DIOS, seguramente van a hacer mella esos 50 gatos porque no votarán por el, del 17% de personas que lo conocen, el 11% de personas votarían por el, entonces ??",,,1,2,https://twitter.com/pedrucho69/status/1427674598238195717
Fernando Manolo,Fernando Manolo,2021-08-17T16:59:31.000Z,"Cualquiera se equivoca. En política sin embargo se paga, pues del error se pegan muchos para desacreditar. Bienvenidas las disculpas que son de caballeros. Fue un lapsus o equivocación muy notoria, por eso se hizo viral.",,1,,1,https://twitter.com/EscobarApraez/status/1427676474392420353
auro,auro,2021-08-18T01:57:44.000Z,"Quote Tweet
auro
@Mauro_Exploit
 · Aug 17
Replying to @Antares019 @DonIzquierdo_ and 11 others
@Antares019 lo siento, NO fue un error del señor. Incluso la mesa de periodistas trataron de corregirlo, pero no, él lo reitero. 
— ""Hitler no fue ningún pensador de nada, pues""
— ""Bueno de esos consejos si... Fue un asesino yo sé. ""

Entrevista completa: https://youtu.be/nuEfauDQgfA",,,,2,https://twitter.com/Mauro_Exploit/status/1427811920896172037
MonchoMatias,MonchoMatias,2021-08-17T17:00:49.000Z,Este sujeto es un pobre chiste burdo y repelente.,,,,4,https://twitter.com/Moncho281/status/1427676801891979265
Apocalypto,Apocalypto,2021-08-17T15:32:46.000Z,"En un país cómo chipchombia sin el amor por el Arte y por la lectura muy fácilmente el cambió de un payaso que toque la guitarra y le pegué al balón lo puede hacer un payaso que arregle todo a golpes, sin necesidad de tener propuestas concretas.",,,,,https://twitter.com/HenryE1979/status/1427654643048456199
Jeison Higuera,Jeison Higuera,2021-08-17T15:46:49.000Z,"Vamos ingeniero, vamos que vamos!",,,,,https://twitter.com/Stevenhig9/status/1427658179396124679
Silvio Brochero Pinzon,Silvio Brochero Pinzon,2021-08-17T15:57:22.000Z,"Si como las mentes brillantes que tenemos en los ministerios, direcciones,  senadores etc que se especializaron en las mejores universidades de Colombia y el mundo especializados en robar el presupuesto de los colombianos.",,,,,https://twitter.com/BrocheroPinzon/status/1427660835984379906
Mr T,Mr T,2021-08-17T16:08:00.000Z,La muestra de su coherencia,,,,,https://twitter.com/alexcountry_san/status/1427663511107293186
Alvaro Arroyave,Alvaro Arroyave,2021-08-17T16:31:38.000Z,"Este señor confunde a Cajamarca, con una marca en la caja...",,,,,https://twitter.com/arrogil/status/1427669460018728972
JACK79,JACK79,2021-08-17T16:32:22.000Z,"Cómo no....UD de bobo no tiene un pelo y si lo fuera, no está apto psicólogicamente para siquiera aspirar gobernar a Colombia. Que por el futuro, esperó no sea ni un sueño.",,,,,https://twitter.com/JACKSONNUEZ4/status/1427669643741831168
loez_216@hotmail.es,loez_216@hotmail.es,2021-08-17T16:34:34.000Z,Jummm...,,,,,https://twitter.com/216Loez/status/1427670198971215878
oscar leonel castell,oscar leonel castell,2021-08-17T16:48:44.000Z,"Me disculpa, no acostumbro léxico fuerte, pero te la cag..te.",,,,,https://twitter.com/noohorac/status/1427673764309999621
Sócialitik Colombia,Sócialitik Colombia,2021-08-17T16:51:50.000Z,"Tranqui, eso es la edad ",,,,,https://twitter.com/SocialitikCol/status/1427674543695568901
𝕾𝖚𝖇𝖈𝖔𝖒𝖆𝖓𝖉𝖆𝖓𝖙𝖊 𝕿𝖎𝖊𝖗𝖗𝖆 𝕸𝖆𝖑𝖆,𝕾𝖚𝖇𝖈𝖔𝖒𝖆𝖓𝖉𝖆𝖓𝖙𝖊 𝕿𝖎𝖊𝖗𝖗𝖆 𝕸𝖆𝖑𝖆,2021-08-17T16:54:49.000Z,"No pida perdón ingeniero, que admirar a Hitler no está mal, malo es aceptar a los judíos.",,,,,https://twitter.com/ninoencruz/status/1427675291221172225
Acostauba58,Acostauba58,2021-08-17T16:58:39.000Z,Mandas huevo....  ya pa qué.... ya la cagaste.,,,,,https://twitter.com/acostauba58/status/1427676259916582917
YOSITOMOKAKAITO,YOSITOMOKAKAITO,2021-08-17T17:00:17.000Z,"Señor, usted necesita ayuda profesional de tipo psiquiátrico, usted está loco, desvaría.",,,,,https://twitter.com/yositomokakaito/status/1427676669620391940
Jorge Rangel Beltrán.,Jorge Rangel Beltrán.,2021-08-17T17:00:40.000Z,"Errar es de humanos, fuerza Rodolfo.",,,,,https://twitter.com/jorgerangelbelt/status/1427676765518974976
Yesid Gutierrez,Yesid Gutierrez,2021-08-17T17:03:04.000Z,"Veremos que cara pinta el viejito para la segunda vuelta presidencial, entre Petro y el candidato del uribismo, por quién se inclinará? Veremos!",,,,,https://twitter.com/YesidGutierrez2/status/1427677369008115715
El Juanmi,El Juanmi,2021-08-17T17:03:25.000Z,"¿Y así quiere ser presidente de Colombia?
Pfffffffff",,,,,https://twitter.com/Puerrres/status/1427677459005198345
buenaventura y caney!!!,buenaventura y caney!!!,2021-08-17T17:10:07.000Z,"Que Dijo , Que Dijo.",,,,,https://twitter.com/jairbond/status/1427679144863834119
⫷b⫸⫷𝗢⫸⫷z⫸⫷𝗚⫸⫷e⫸,⫷b⫸⫷𝗢⫸⫷z⫸⫷𝗚⫸⫷e⫸,2021-08-17T17:10:18.000Z,Too late... Hay una gran diferencia de uno a otro,,,,1,https://twitter.com/OscarInBelize/status/1427679191185641472
Enrique Noguera,Enrique Noguera,2021-08-17T17:13:01.000Z,"Igualito al que le debe la deuda de honor , que peligro",,,,,https://twitter.com/lusan_11/status/1427679872680402946
El chino Alejo,El chino Alejo,2021-08-17T17:13:39.000Z,Solo a vos te da por confundir a Hittler con Einstein,,,,,https://twitter.com/elalephcastull/status/1427680033385164807
m. areiza,m. areiza,2021-08-17T17:14:57.000Z,"Ingeniero, yo creo en usted a pesar de ser de Medellín, he visto su obra y me parece una persona honesta. Pero ya van dos metidas de pata: le le debía a Uribe y la de Einstein. Debe cuidar sus intervenciones que aquí no perdonan nada. Ánimos y abajo las ratas HP del gob.",,1,,,https://twitter.com/maritza_ariza12/status/1427680360041701382
José Antonio Rueda,José Antonio Rueda,2021-08-17T17:17:55.000Z,"Pero le debe y admira a Uribe...y ese genocida es peor que Hitler, Hess y Goebels juntos ...",,,1,1,https://twitter.com/JosAntonioRue20/status/1427681108150337549
ROMMEL PEÑARANDA.,ROMMEL PEÑARANDA.,2021-08-17T17:18:19.000Z,"Ingeniero, cualquiera se equivoca. My fiurer!. Jjajajajajajajaj. ",,,,,https://twitter.com/ROMMELCONTRERA5/status/1427681206733266946
Chaucer,Chaucer,2021-08-17T17:19:13.000Z,"Usted es un viejo ignorante tratando de dárselas de culto; si uno lee o es partidario de algún autor es imposible confundirlo con otro, ¿o usted se confunde y caga de pie?",,,,,https://twitter.com/yosoyCtulhu/status/1427681432059748356
SanPrada,SanPrada,2021-08-17T17:19:47.000Z,Jajajajajsjsjsjs y de lo que le debe a Urube?,,,,,https://twitter.com/san_prada/status/1427681577644044291
Del Mar.,Del Mar.,2021-08-17T17:20:20.000Z,Jaaaaa jajajaj,,,,,https://twitter.com/oscarlo25222200/status/1427681713359134720
daniel melo,daniel melo,2021-08-17T17:20:40.000Z,"Rodolfo Hernazi, quedaste muy mal desde cuando reconoce su admiración por nuestro Adolf Uribe",,,,4,https://twitter.com/cardanielm/status/1427681798914551815
Davidp0628@yahoo.com,Davidp0628@yahoo.com,2021-08-17T17:20:52.000Z,Diculpas...ya pa'que hps.,,,,,https://twitter.com/davidp0628/status/1427681850718408706
Jairo Moreno,Jairo Moreno,2021-08-17T17:21:42.000Z,Rodolfo Ud a veces habla con la.emoción y la.ira y no piensa lo que habla..que ofensa.ala.comunidad.judía tan grande.Albert.un científico con un genocida y dictador,,,,,https://twitter.com/JairoMo71747935/status/1427682058101481479
SanPrada,SanPrada,2021-08-17T17:21:45.000Z,Cuéntanos de tu admiración por AUV ?,,,,1,https://twitter.com/san_prada/status/1427682069589680135
PAPEYEJOS,PAPEYEJOS,2021-08-17T17:37:20.000Z,"Hay ruidolfo y la deuda q le debes a Uribe , también es un lapsus , viejo rrococa !!",,,,1,https://twitter.com/laco12345606/status/1427685992916529153
JuanBogotá,JuanBogotá,2021-08-17T17:38:54.000Z,Y esto señor Hernández también fue un lapsus? o esto si es lo que piensa.,,3,46,170,https://twitter.com/Juan0Bogota/status/1427686387550244865
José Vicente,José Vicente,2021-08-17T18:03:33.000Z,"No le den importancia a ese viejito cavernario, nada que ver.",,2,5,105,https://twitter.com/joseshidarta/status/1427692591135563781
José Vicente,José Vicente,2021-08-17T17:39:25.000Z,"No salga solo a la calle, se puede extraviar, cuide ese ALZHEIMER.",,1,3,57,https://twitter.com/joseshidarta/status/1427686516092985346
Diana,Diana,2021-08-17T17:40:26.000Z,"Uy  no, con esos errores y quiere ser presidente? Que tal le diga Maduro a Biden?",,,,7,https://twitter.com/DianaRa74250112/status/1427686773275168771
JH,JH,2021-08-17T17:41:12.000Z,"que lapsus, no...",,,4,12,https://twitter.com/JH17344834/status/1427686966829723661
Nestor Raul Reyes S,Nestor Raul Reyes S,2021-08-17T17:42:32.000Z,Jjajajaj. Lo coguio el alemán #Alzheimer . Ojal se acuerde de la 20 mil casas que prometió en Bucaramanga.,,,1,2,https://twitter.com/nestorrreyes/status/1427687301690363918
Saulitro,Saulitro,2021-08-17T17:49:10.000Z,La cagamos...,,1,,,https://twitter.com/saulitro23s/status/1427688970297696258
Luv,Luv,2021-08-17T17:52:18.000Z,"Jum, lo traicionó la mente. 
La vd no me extraña que lo apoyen uribistas.",,,,1,https://twitter.com/Suholover00/status/1427689760173301771
Magda,Magda,2021-08-17T17:55:12.000Z,"Umm pero Einstein empieza por la E y Hitler por la H no se parecen en nada esos nombres, no sé, ummm , solo sé que por eso lo siguen las uribestias",,,,8,https://twitter.com/Magdale76474067/status/1427690488501526533
LUIS ERNESTO SUAREZ. O.,LUIS ERNESTO SUAREZ. O.,2021-08-17T18:01:50.000Z,Que se puede esperar .,,,,1,https://twitter.com/Santander1953/status/1427692160493686784
Edwin Palma Egea,Edwin Palma Egea,2021-08-17T18:05:11.000Z,"Confundir Hitler con Einstein... Jajajaja

Todo un loquito. Ojo que puede ser presidente y confunde desoues masacres con asesinatos colectivos.",,1,1,24,https://twitter.com/PalmaEdwin/status/1427693003142057984
NELSON,NELSON,2021-08-18T05:39:10.000Z,Como así Edwin.. pensé que apoyaba a Rodolfo,,1,,,https://twitter.com/NelsonPlata4/status/1427867649573363715
Miguel Moreno A.,Miguel Moreno A.,2021-08-17T18:06:42.000Z,"Adolf la embarraste, perdón Rodolf.. jaja.
Pero errar es de un Humanos y se trata de aprender a pedir disculpas. 
Pdt: Entra al pacto histórico.",,,1,2,https://twitter.com/Miguel_Hernando/status/1427693381354983431
Majitawow,Majitawow,2021-08-17T18:16:57.000Z,"Los zurdos son los únicos q no se equivocan, lo critican por q le tiene Miedo, el trabajo y la productividad conforme a sus habilidades y desempeño  los aterra",,1,,1,https://twitter.com/Pavky123/status/1427695963049758722
auro,auro,2021-08-18T01:58:40.000Z,"Quote Tweet
auro
@Mauro_Exploit
 · Aug 17
Replying to @Antares019 @DonIzquierdo_ and 11 others
@Antares019 lo siento, NO fue un error del señor. Incluso la mesa de periodistas trataron de corregirlo, pero no, él lo reitero. 
— ""Hitler no fue ningún pensador de nada, pues""
— ""Bueno de esos consejos si... Fue un asesino yo sé. ""

Entrevista completa: https://youtu.be/nuEfauDQgfA",,,,,https://twitter.com/Mauro_Exploit/status/1427812158822178821
auro,auro,2021-08-18T01:58:40.000Z,"Quote Tweet
auro
@Mauro_Exploit
 · Aug 17
Replying to @Antares019 @DonIzquierdo_ and 11 others
@Antares019 lo siento, NO fue un error del señor. Incluso la mesa de periodistas trataron de corregirlo, pero no, él lo reitero. 
— ""Hitler no fue ningún pensador de nada, pues""
— ""Bueno de esos consejos si... Fue un asesino yo sé. ""

Entrevista completa: https://youtu.be/nuEfauDQgfA
0:26
125 views",,,,,https://twitter.com/Mauro_Exploit/status/1427812158822178821
Wilson Manuel Mora C,Wilson Manuel Mora C,2021-08-17T18:20:10.000Z,"Cada vez que necesita votos pide disculpas... Cuando esta elegido pide ejecuciones al estilo nazi, sin respetar los derechos de los demás. 
@vanguardiacom",,,,2,https://twitter.com/WilsonMora8890/status/1427696773020192773
Volver a vivir,Volver a vivir,2021-08-17T18:20:36.000Z,Y para que queremos un presidente así????  Nos disculpamos por 4 años haciendo cagadas?,,,,3,https://twitter.com/Latessa91877484/status/1427696879450611714
DCp,DCp,2021-08-17T18:22:55.000Z,"Uy pero ese señor confunde la mierda con la pomada, que peligró",,,,4,https://twitter.com/cp_dcp/status/1427697462412730382
Jalil,Jalil,2021-08-17T18:25:17.000Z,"Cómo todo fascistoides reculó, nada raro estamos en el gobierno de las mentiras y las excusas cul.....s.",,,1,1,https://twitter.com/Jalil10828906/status/1427698060889571329
QUIROGA,QUIROGA,2021-08-17T18:26:44.000Z,"Quien cree que Adolfo Hitler es un pensador y que además manifestó le debe favores a Uribe, no merece el voto de los colombianos.",,,,2,https://twitter.com/gorditoquiroga/status/1427698424024010754
Luis Rodriguez,Luis Rodriguez,2021-08-17T18:26:58.000Z,"BUENO, PERO AMANDO A URIBE ES SUFICIENTE
LO DEL ALEMÁN DEJEMOS LO AHÍ",,,1,7,https://twitter.com/LuisRod27513586/status/1427698484099043329
Carlos Abdul Valero,Carlos Abdul Valero,2021-08-17T18:32:09.000Z,En este momento los judíos estan peor que los nazis... con el pueblo palestino...,,1,1,6,https://twitter.com/Valeroabdul/status/1427699786401079300
sergio sanchez,sergio sanchez,2021-08-18T11:36:49.000Z,"Eso sí que no pero si hay muchas injusticias, recuerda que no son solo las protestas, en palestina se alberga HAMAS..... No justifico ninguna atrocidad, ofrezco la realidad alternativa....",,1,,,https://twitter.com/Se1795/status/1427957655419637761
Yona Rincon,Yona Rincon,2021-08-17T18:40:15.000Z,Y el genocida colombiano le debe mucho?,,,,2,https://twitter.com/YonaRincon/status/1427701826237906955
HerU,HerU,2021-08-17T18:47:20.000Z,Senil como el patrón...,,,,1,https://twitter.com/uribevideos/status/1427703609588961282
Víctor,Víctor,2021-08-17T18:53:21.000Z,"Entonces como ya estás senil ya no está apto para ser presidente, chao",,,1,4,https://twitter.com/VctorHugoChapa1/status/1427705121346052096
Abudineando Ando,Abudineando Ando,2021-08-17T19:18:08.000Z,Y el pegarle a la gente también hace parte de sus lapsus?,,,,2,https://twitter.com/roseandjack9/status/1427711359215710218
A. T. P.,A. T. P.,2021-08-17T19:23:36.000Z,"Usted además de bocón es un atarbán. Cuando aclare el presunto cobro de comisiones de su hijo por contratos durante su alcaldía podrá aspirar al respeto de la gente.
@funurbiano
 @EstebanCarlosM
 @oscaramontoya
 @PampineaXII
 @yumnapa
 @HFCardonaG
 @chucurena",,,,3,https://twitter.com/al3pape/status/1427712736377593864
